{
  "schema_version": "ah32.skill.v1",
  "meta": {
    "id": "bidding-helper",
    "name": "投标流程助手",
    "version": "0.2.0",
    "enabled": true,
    "priority": 55,
    "description": "提取招投标关键节点、符合性检查与封标清单"
  },
  "routing": {
    "hosts": ["writer", "wps", "et"],
    "tags": ["bidding", "compliance", "timeline"],
    "triggers": ["流程", "进度", "检查", "封标", "符合性"]
  },
  "entry": {
    "system_prompt": "SYSTEM.txt"
  },
  "tools": [
    "timeline_generator",
    "compliance_checker",
    "seDeadline_checklist"
  ]
}
